{
  "schema_version": "1.0",
  "status": "complete",
  "evidence_tier": "measured",
  "source_result": {
    "result_id": "687a5df737d36e4a4596efc3",
    "renderer_id": "gsplat_higs",
    "config_id": "gsplat_higs_tile16_sh32",
    "case_id": "medium-train-1080p",
    "metrics_sha256": "c6d490bce96d6e438f351bbe57139d9e31af09aef0b888ee96de1e80c3622c7f",
    "raw_samples_sha256": "6bcbd55cb8d794e936a87ba6cebe0823825f865d61232cac70623ed7d43c1e4f"
  },
  "sequence": {
    "frame_count": 100,
    "transition_count": 99,
    "camera_order": "canonical evaluation manifest order",
    "metric_scope": "adjacent-frame RGB delta residual; no optical-flow compensation"
  },
  "metrics": {
    "mean_temporal_residual": 0.10817423553177805,
    "p95_temporal_residual": 0.3464052677154541,
    "mean_luma_temporal_residual": 0.10804038987767817,
    "temporal_delta_psnr_db": 15.863871841414461
  },
  "provenance": {
    "source_metrics": "/root/3dgs-roadmap-matrix/results/measured/gsplat_higs_tile16_sh32/tanks_and_temples/train/20260723T181203Z/metrics.json",
    "ground_truth_dir": "/root/3dgs-roadmap-matrix/datasets/processed/tanks_and_temples/train/eval_images"
  }
}
